{"schemaVersion":"1.0.0","runId":"run-20260719051158132-8430f38f-de50-4a7d-8bb1-6b0d52d728b7","reportKey":"harness-single-channel-cd","environment":"real-pre","scope":"full","startedAt":"2026-07-19T05:11:58.132Z","startedAtShanghai":"2026-07-19 13:11:58 Asia/Shanghai","finishedAt":"2026-07-19T05:21:36.523Z","finishedAtShanghai":"2026-07-19 13:21:36 Asia/Shanghai","durationMs":578391,"git":{"branch":"codex/harness-node-verify-phase1","changedFiles":[".env.real-pre.example",".github/workflows/ci.yml",".github/workflows/release-images.yml","AGENTS.md","backend/Dockerfile","backend/pom.xml","backend/src/main/java/com/colonel/saas/config/RuntimeVersionProvider.java","backend/src/main/java/com/colonel/saas/controller/SystemEnvController.java","backend/src/main/resources/application-real-pre.yml","backend/src/main/resources/application-test.yml","backend/src/main/resources/db/migrate-all.sql","backend/src/test/java/com/colonel/saas/config/RuntimeVersionProviderTest.java","backend/src/test/java/com/colonel/saas/controller/SystemEnvControllerTest.java","backend/src/test/java/com/colonel/saas/service/data/DataApplicationServiceOrderSummaryCacheTest.java","docker-compose.real-pre.release.yml","docker-compose.real-pre.yml","docs/10-部署运行总览.md","docs/deploy/00-服务器部署总览.md","docs/deploy/06-回滚与故障排查.md","docs/deploy/07-Jenkins自动化部署规划.md","docs/deploy/README.md","docs/README.md","docs/决策/ADR-015-real-pre单通道CD与不可变发布.md","frontend/Dockerfile","frontend/package-lock.json","harness/archive/retired-content/20260718-232348/standalone-retro/latest-retro-evidence-20260713.md","harness/archive/retired-content/20260718-232348/standalone-retro/retro-20260713-harness-redundancy-cleanup.md","harness/archive/retired-content/20260718-232348/standalone-retro/retro-user-soft-deleted-restore.md","harness/archive/retired-content/20260718-232348/standalone-retro/retro-xiangyun-biz-staff-talent-20260717.md","harness/archive/retired-content/20260718-232348/superseded-evidence-maintenance/latest-product-library-cross-platform-evidence-retire.md","harness/archive/retired-content/20260718-232348/superseded-evidence-maintenance/latest-product-library-rich-clipboard-evidence-amend.md","harness/archive/retired-content/20260718-232743/superseded-harness-design/latest-evidence-20260713-harness-layered-file-governance-design.md","harness/archive/retired-content/20260718-232743/superseded-harness-design/latest-evidence-20260713.md","harness/manifests/single-channel-cd-current-report-retirement-20260718.json","harness/manifests/single-channel-cd-current-report-retirement-extra-20260718.json","harness/reports/current/latest-content-retire.md","harness/reports/current/latest-evidence-20260713-harness-layered-file-governance-design.md","harness/reports/current/latest-evidence-20260713.md","harness/reports/current/latest-harness-limits-check.md","harness/reports/current/latest-harness-single-channel-cd.json","harness/reports/current/latest-harness-single-channel-cd.md","harness/reports/current/latest-product-library-cross-platform-evidence-retire.md","harness/reports/current/latest-product-library-rich-clipboard-evidence-amend.md","harness/reports/current/latest-retro-evidence-20260713.md","harness/reports/current/retro-20260713-harness-redundancy-cleanup.md","harness/reports/current/retro-user-soft-deleted-restore.md","harness/reports/current/retro-xiangyun-biz-staff-talent-20260717.md","harness/rules/changelog.md","harness/rules/cicd-real-pre-policy.md","harness/rules/environment/CHEATSHEET.md","harness/rules/environment/envs/remote-real-pre-env.md","harness/rules/governance/completion-gates-git.md","harness/rules/governance/task-routing.md","harness/rules/policies/agent-contract.md","harness/rules/runbooks/governance/scope-command-matrix.md","harness/rules/runbooks/governance/task-lifecycle.md","harness/rules/runbooks/remote-deploy.md","harness/rules/runbooks/rollback.md","harness/rules/skills/git/git-change-control.commit.md","harness/rules/state/snapshots/DEPLOYMENT_STATE.md","harness/scripts/commands/_lib.ps1","harness/scripts/commands/agent-do.ps1","harness/scripts/commands/deploy-remote.ps1","harness/scripts/commands/git-push-safe.ps1","harness/scripts/modules/HarnessFileGovernance.psm1","harness/scripts/tests/agent-do-node-delegation.Tests.ps1","harness/scripts/tests/check-harness-limits.Tests.ps1","harness/scripts/tests/release-channel.Tests.ps1","harness/scripts/tests/report-lifecycle.Tests.ps1","Jenkinsfile","scripts/check-acr-creds.ps1","scripts/deploy-real-pre.sh","scripts/deploy-release.sh","scripts/health-check.sh","scripts/rollback-real-pre.sh"],"clean":false,"identity":{"headSha":"651945d3444dc734f9d07ed0275f983e21aad7ee","changedFiles":[".env.real-pre.example",".github/workflows/ci.yml",".github/workflows/release-images.yml","AGENTS.md","backend/Dockerfile","backend/pom.xml","backend/src/main/java/com/colonel/saas/config/RuntimeVersionProvider.java","backend/src/main/java/com/colonel/saas/controller/SystemEnvController.java","backend/src/main/resources/application-real-pre.yml","backend/src/main/resources/application-test.yml","backend/src/main/resources/db/migrate-all.sql","backend/src/test/java/com/colonel/saas/config/RuntimeVersionProviderTest.java","backend/src/test/java/com/colonel/saas/controller/SystemEnvControllerTest.java","backend/src/test/java/com/colonel/saas/service/data/DataApplicationServiceOrderSummaryCacheTest.java","docker-compose.real-pre.release.yml","docker-compose.real-pre.yml","docs/10-部署运行总览.md","docs/deploy/00-服务器部署总览.md","docs/deploy/06-回滚与故障排查.md","docs/deploy/07-Jenkins自动化部署规划.md","docs/deploy/README.md","docs/README.md","docs/决策/ADR-015-real-pre单通道CD与不可变发布.md","frontend/Dockerfile","frontend/package-lock.json","harness/archive/retired-content/20260718-232348/standalone-retro/latest-retro-evidence-20260713.md","harness/archive/retired-content/20260718-232348/standalone-retro/retro-20260713-harness-redundancy-cleanup.md","harness/archive/retired-content/20260718-232348/standalone-retro/retro-user-soft-deleted-restore.md","harness/archive/retired-content/20260718-232348/standalone-retro/retro-xiangyun-biz-staff-talent-20260717.md","harness/archive/retired-content/20260718-232348/superseded-evidence-maintenance/latest-product-library-cross-platform-evidence-retire.md","harness/archive/retired-content/20260718-232348/superseded-evidence-maintenance/latest-product-library-rich-clipboard-evidence-amend.md","harness/archive/retired-content/20260718-232743/superseded-harness-design/latest-evidence-20260713-harness-layered-file-governance-design.md","harness/archive/retired-content/20260718-232743/superseded-harness-design/latest-evidence-20260713.md","harness/manifests/single-channel-cd-current-report-retirement-20260718.json","harness/manifests/single-channel-cd-current-report-retirement-extra-20260718.json","harness/reports/current/latest-content-retire.md","harness/reports/current/latest-evidence-20260713-harness-layered-file-governance-design.md","harness/reports/current/latest-evidence-20260713.md","harness/reports/current/latest-harness-limits-check.md","harness/reports/current/latest-harness-single-channel-cd.json","harness/reports/current/latest-harness-single-channel-cd.md","harness/reports/current/latest-product-library-cross-platform-evidence-retire.md","harness/reports/current/latest-product-library-rich-clipboard-evidence-amend.md","harness/reports/current/latest-retro-evidence-20260713.md","harness/reports/current/retro-20260713-harness-redundancy-cleanup.md","harness/reports/current/retro-user-soft-deleted-restore.md","harness/reports/current/retro-xiangyun-biz-staff-talent-20260717.md","harness/rules/changelog.md","harness/rules/cicd-real-pre-policy.md","harness/rules/environment/CHEATSHEET.md","harness/rules/environment/envs/remote-real-pre-env.md","harness/rules/governance/completion-gates-git.md","harness/rules/governance/task-routing.md","harness/rules/policies/agent-contract.md","harness/rules/runbooks/governance/scope-command-matrix.md","harness/rules/runbooks/governance/task-lifecycle.md","harness/rules/runbooks/remote-deploy.md","harness/rules/runbooks/rollback.md","harness/rules/skills/git/git-change-control.commit.md","harness/rules/state/snapshots/DEPLOYMENT_STATE.md","harness/scripts/commands/_lib.ps1","harness/scripts/commands/agent-do.ps1","harness/scripts/commands/deploy-remote.ps1","harness/scripts/commands/git-push-safe.ps1","harness/scripts/modules/HarnessFileGovernance.psm1","harness/scripts/tests/agent-do-node-delegation.Tests.ps1","harness/scripts/tests/check-harness-limits.Tests.ps1","harness/scripts/tests/release-channel.Tests.ps1","harness/scripts/tests/report-lifecycle.Tests.ps1","Jenkinsfile","scripts/check-acr-creds.ps1","scripts/deploy-real-pre.sh","scripts/deploy-release.sh","scripts/health-check.sh","scripts/rollback-real-pre.sh"],"patchFingerprint":"sha256:4e521c1993fa49e5f267e15d607ac39f04473b62faee0f3948b82835cba56bcc","kind":"WORKTREE"},"headSha":"651945d3444dc734f9d07ed0275f983e21aad7ee"},"result":{"schemaVersion":"1.0.0","status":"PASS","statusLabel":"通过","summary":"全部阻断检查均已通过。","checks":[{"schemaVersion":"1.0.0","checkId":"repository.structure","title":"检查仓库结构","status":"PASS","blocking":true,"summary":"仓库结构与当前 Harness 入口完整。","nextActions":[],"artifacts":[],"statusLabel":"通过"},{"schemaVersion":"1.0.0","checkId":"environment.files","title":"检查环境文件","status":"PASS","blocking":true,"summary":"Compose、示例文件与实际 .env.real-pre 均存在。","nextActions":[],"artifacts":["docker-compose.real-pre.yml",".env.real-pre.example"],"statusLabel":"通过"},{"schemaVersion":"1.0.0","checkId":"environment.required-config","title":"检查必需配置","status":"PASS","blocking":true,"summary":"必需配置键均已填写；未输出任何配置值。","nextActions":[],"artifacts":[],"statusLabel":"通过"},{"schemaVersion":"1.0.0","checkId":"environment.hard-switches","title":"检查环境硬开关","status":"PASS","blocking":true,"summary":"环境硬开关符合当前环境基线。","nextActions":[],"artifacts":[],"statusLabel":"通过"},{"schemaVersion":"1.0.0","checkId":"environment.secrets","title"